{
  "schema_version": 1,
  "registry_version": "1.2.0",
  "generated_at": "2026-07-11T12:00:00.000Z",
  "providers": [
    {
      "id": "cesiumjs",
      "name": "CesiumJS",
      "homepage_url": "https://cesium.com/platform/cesiumjs/",
      "terms_url": "https://github.com/CesiumGS/cesium/blob/main/LICENSE.md",
      "license_url": "https://www.apache.org/licenses/LICENSE-2.0",
      "endpoint_origins": [],
      "auth_mode": "bundled",
      "attribution_mode": "static",
      "policy_checked_at": "2026-07-11",
      "policy_review_by": "2027-07-11",
      "capabilities": { "online": false, "offline": true, "dynamic_credits": false, "version_reporting": true }
    },
    {
      "id": "natural-earth",
      "name": "Natural Earth",
      "homepage_url": "https://www.naturalearthdata.com/",
      "terms_url": "https://www.naturalearthdata.com/about/terms-of-use/",
      "license_url": "https://www.naturalearthdata.com/about/terms-of-use/",
      "endpoint_origins": [],
      "auth_mode": "bundled",
      "attribution_mode": "static",
      "policy_checked_at": "2026-07-11",
      "policy_review_by": "2027-07-11",
      "capabilities": { "online": false, "offline": true, "dynamic_credits": false, "version_reporting": false }
    },
    {
      "id": "openstreetmap",
      "name": "OpenStreetMap Foundation tile service",
      "homepage_url": "https://www.openstreetmap.org/",
      "terms_url": "https://operations.osmfoundation.org/policies/tiles/",
      "license_url": "https://www.openstreetmap.org/copyright",
      "endpoint_origins": ["https://tile.openstreetmap.org"],
      "auth_mode": "none",
      "attribution_mode": "static",
      "policy_checked_at": "2026-07-11",
      "policy_review_by": "2027-01-11",
      "capabilities": { "online": true, "offline": false, "dynamic_credits": false, "version_reporting": false }
    },
    {
      "id": "esri",
      "name": "Esri World Imagery",
      "homepage_url": "https://www.arcgis.com/home/item.html?id=10df2279f9684e4a9f6a7f08febac2a9",
      "terms_url": "https://www.esri.com/en-us/legal/terms/full-master-agreement",
      "license_url": "https://developers.arcgis.com/documentation/mapping-apis-and-services/deployment/attribution/",
      "endpoint_origins": ["https://server.arcgisonline.com"],
      "auth_mode": "none",
      "attribution_mode": "dynamic",
      "policy_checked_at": "2026-07-11",
      "policy_review_by": "2027-01-11",
      "capabilities": { "online": true, "offline": false, "dynamic_credits": true, "version_reporting": false }
    },
    {
      "id": "cesium-ion",
      "name": "Cesium ion",
      "homepage_url": "https://cesium.com/platform/cesium-ion/",
      "terms_url": "https://cesium.com/legal/terms-of-service/",
      "license_url": "https://cesium.com/legal/credits/",
      "endpoint_origins": ["https://api.cesium.com", "https://assets.cesium.com"],
      "auth_mode": "user-token",
      "attribution_mode": "dynamic",
      "policy_checked_at": "2026-07-11",
      "policy_review_by": "2027-01-11",
      "capabilities": { "online": true, "offline": false, "dynamic_credits": true, "version_reporting": true }
    },
    {
      "id": "cataclysm",
      "name": "Cataclysm project",
      "homepage_url": "https://github.com/SysAdminDoc/Cataclysm",
      "terms_url": "https://github.com/SysAdminDoc/Cataclysm/blob/main/LICENSE",
      "license_url": "https://opensource.org/license/mit",
      "endpoint_origins": [],
      "auth_mode": "bundled",
      "attribution_mode": "static",
      "policy_checked_at": "2026-07-11",
      "policy_review_by": "2027-07-11",
      "capabilities": { "online": false, "offline": true, "dynamic_credits": false, "version_reporting": true }
    },
    {
      "id": "noaa-ndbc",
      "name": "NOAA National Data Buoy Center",
      "homepage_url": "https://www.ndbc.noaa.gov/",
      "terms_url": "https://www.weather.gov/disclaimer",
      "license_url": "https://www.weather.gov/disclaimer",
      "endpoint_origins": [],
      "auth_mode": "bundled",
      "attribution_mode": "static",
      "policy_checked_at": "2026-07-11",
      "policy_review_by": "2027-07-11",
      "capabilities": { "online": false, "offline": true, "dynamic_credits": false, "version_reporting": false }
    }
  ],
  "permission_profiles": [
    {
      "id": "public-domain-bundled",
      "permissions": {
        "interactive_render": { "decision": "allowed", "conditions": ["Preserve source attribution in the application."], "source_url": "https://www.naturalearthdata.com/about/terms-of-use/", "reviewed_at": "2026-07-11" },
        "transient_http_cache": { "decision": "allowed", "conditions": ["Asset is bundled; no network cache is created."], "source_url": "https://www.naturalearthdata.com/about/terms-of-use/", "reviewed_at": "2026-07-11" },
        "prefetch": { "decision": "allowed", "conditions": ["Asset is already bundled."], "source_url": "https://www.naturalearthdata.com/about/terms-of-use/", "reviewed_at": "2026-07-11" },
        "offline_package": { "decision": "allowed", "conditions": ["Preserve provenance metadata."], "source_url": "https://www.naturalearthdata.com/about/terms-of-use/", "reviewed_at": "2026-07-11" },
        "raw_redistribution": { "decision": "allowed", "conditions": ["Preserve provenance metadata."], "source_url": "https://www.naturalearthdata.com/about/terms-of-use/", "reviewed_at": "2026-07-11" },
        "static_capture": { "decision": "allowed", "conditions": ["Keep visible attribution in exported media."], "source_url": "https://www.naturalearthdata.com/about/terms-of-use/", "reviewed_at": "2026-07-11" },
        "video_capture": { "decision": "allowed", "conditions": ["Keep visible attribution in exported media."], "source_url": "https://www.naturalearthdata.com/about/terms-of-use/", "reviewed_at": "2026-07-11" },
        "derived_data": { "decision": "allowed", "conditions": ["Record transformations in provenance."], "source_url": "https://www.naturalearthdata.com/about/terms-of-use/", "reviewed_at": "2026-07-11" },
        "commercial_use": { "decision": "allowed", "conditions": ["No endorsement is implied."], "source_url": "https://www.naturalearthdata.com/about/terms-of-use/", "reviewed_at": "2026-07-11" }
      }
    },
    {
      "id": "osm-standard-tiles",
      "permissions": {
        "interactive_render": { "decision": "allowed", "conditions": ["Display OpenStreetMap attribution and identify the application with a valid User-Agent."], "source_url": "https://operations.osmfoundation.org/policies/tiles/", "reviewed_at": "2026-07-11" },
        "transient_http_cache": { "decision": "allowed", "conditions": ["Honor HTTP cache headers and do not bypass caches."], "source_url": "https://operations.osmfoundation.org/policies/tiles/", "reviewed_at": "2026-07-11" },
        "prefetch": { "decision": "prohibited", "conditions": ["Bulk downloading and prefetching are prohibited by the standard tile policy."], "source_url": "https://operations.osmfoundation.org/policies/tiles/", "reviewed_at": "2026-07-11" },
        "offline_package": { "decision": "prohibited", "conditions": ["The standard tile service may not be used for offline tile archives."], "source_url": "https://operations.osmfoundation.org/policies/tiles/", "reviewed_at": "2026-07-11" },
        "raw_redistribution": { "decision": "prohibited", "conditions": ["Do not redistribute tiles from the standard service."], "source_url": "https://operations.osmfoundation.org/policies/tiles/", "reviewed_at": "2026-07-11" },
        "static_capture": { "decision": "allowed", "conditions": ["Show OpenStreetMap attribution on the image."], "source_url": "https://www.openstreetmap.org/copyright", "reviewed_at": "2026-07-11" },
        "video_capture": { "decision": "allowed", "conditions": ["Show OpenStreetMap attribution in the video."], "source_url": "https://www.openstreetmap.org/copyright", "reviewed_at": "2026-07-11" },
        "derived_data": { "decision": "prohibited", "conditions": ["Use the underlying OpenStreetMap database under ODbL instead of deriving data from rendered tiles."], "source_url": "https://www.openstreetmap.org/copyright", "reviewed_at": "2026-07-11" },
        "commercial_use": { "decision": "allowed", "conditions": ["Comply with the tile policy and ODbL attribution requirements."], "source_url": "https://www.openstreetmap.org/copyright", "reviewed_at": "2026-07-11" }
      }
    },
    {
      "id": "esri-online-imagery",
      "permissions": {
        "interactive_render": { "decision": "allowed", "conditions": ["Display all dynamic service-layer and data-source attribution."], "source_url": "https://developers.arcgis.com/documentation/mapping-apis-and-services/deployment/attribution/", "reviewed_at": "2026-07-11" },
        "transient_http_cache": { "decision": "allowed", "conditions": ["Use only normal client caching controlled by service responses."], "source_url": "https://www.esri.com/en-us/legal/terms/full-master-agreement", "reviewed_at": "2026-07-11" },
        "prefetch": { "decision": "prohibited", "conditions": ["No bulk tile harvesting is implemented or authorized by this registry."], "source_url": "https://www.esri.com/en-us/legal/terms/full-master-agreement", "reviewed_at": "2026-07-11" },
        "offline_package": { "decision": "prohibited", "conditions": ["This public online service binding is streaming-only."], "source_url": "https://www.esri.com/en-us/legal/terms/full-master-agreement", "reviewed_at": "2026-07-11" },
        "raw_redistribution": { "decision": "prohibited", "conditions": ["Do not redistribute source tiles."], "source_url": "https://www.esri.com/en-us/legal/terms/full-master-agreement", "reviewed_at": "2026-07-11" },
        "static_capture": { "decision": "allowed", "conditions": ["Preserve all dynamic attribution returned by the service."], "source_url": "https://developers.arcgis.com/documentation/mapping-apis-and-services/deployment/attribution/", "reviewed_at": "2026-07-11" },